{
  "authority": {
    "blindness": "content_blinded_public_source",
    "gold_authority": false,
    "promotion_eligible": false,
    "purpose": "guideline_calibration"
  },
  "case_count": 64,
  "cases_file": "cases.jsonl",
  "cases_sha256": "9fe02cdc9b3b05a30c0c73ad8d60ad29fcc9876ecb2a325c56d2cc2960c0872f",
  "created_at": "2026-08-27T10:00:00Z",
  "packet_id": "p4-semantic-pilot-v1",
  "protocol_version": "frontier-atlas-open-test-v1",
  "schema_version": 1,
  "source_count": 0,
  "sources_file": null,
  "sources_sha256": null,
  "visibility": {
    "assignment_map_private": true,
    "attack_metadata_included": false,
    "labels_included": false,
    "model_outputs_included": false,
    "pair_ids_included": false,
    "severity_included": false
  }
}
